{
  "spec_title": "Agent-first spec processing",
  "spec_body": "Capture requirements, validate dependencies, and create approved issues.",
  "request_type": "new-feature",
  "project_dir": ".",
  "ai_assistant": "codex",
  "tasks": [
    {
      "task_id": "define-contracts",
      "title": "Define stable contracts",
      "description": "Create typed schemas and versioning policy.",
      "depends_on": [],
      "parallelizable": true
    },
    {
      "task_id": "bdd-tests",
      "title": "Write BDD feature scenarios",
      "description": "Define feature expectations before implementation.",
      "depends_on": ["define-contracts"],
      "parallelizable": true
    },
    {
      "task_id": "impl",
      "title": "Implement deterministic orchestrator",
      "description": "Build planner, human gates, and issue publisher.",
      "depends_on": ["bdd-tests"],
      "parallelizable": false
    }
  ],
  "dry_run": true
}
